{"$schema":"https://json-schema.org/draft/2020-12/schema","title":"LazySeries Host Observation","type":"object","additionalProperties":false,"required":["schema_version","contract_version","record_type","observation_id","event_id","host","session_id","status","observed_at","surface","facts"],"properties":{"schema_version":{"const":1},"contract_version":{"const":"1.0.0"},"record_type":{"const":"host-observation"},"observation_id":{"$ref":"lazyseries-host-evidence-defs.v1.schema.json#/$defs/id"},"event_id":{"$ref":"lazyseries-host-evidence-defs.v1.schema.json#/$defs/id"},"host":{"$ref":"lazyseries-host-evidence-defs.v1.schema.json#/$defs/host"},"session_id":{"$ref":"lazyseries-host-evidence-defs.v1.schema.json#/$defs/id"},"status":{"enum":["observed","unsupported"]},"observed_at":{"$ref":"lazyseries-host-evidence-defs.v1.schema.json#/$defs/timestamp"},"surface":{"$ref":"lazyseries-host-evidence-defs.v1.schema.json#/$defs/surface"},"facts":{"type":"array","items":{"type":"object","additionalProperties":false,"required":["name","value"],"properties":{"name":{"$ref":"lazyseries-host-evidence-defs.v1.schema.json#/$defs/id"},"value":{"type":["string","number","boolean"]}}}}}}
